訓練單位名稱,縣市別辦訓地,課程代碼,課程名稱,訓練時數,訓練人次,每人訓練費用,開訓日期,結訓日期
"高雄市傳統整復推拿教育協會","高雄市","161909","民俗調理舒壓技能班","91","20","15760","20250311","20250617"
"高雄市傳統整復推拿教育協會","高雄市","161910","傳統整復推拿調理班","91","20","15760","20250316","20250713"
"中華五術教育產業工會","高雄市","161911","紫微斗數命理應用班","78","16","12800","20250222","20250524"
"高雄市膚質檢測從業人員職業工會","高雄市","161913","保養用品＆清潔用品調製班","91","20","20260","20250308","20250628"
"高雄市膚質檢測從業人員職業工會","高雄市","161914","手工皂技能班","91","20","20260","20250320","20250710"
"高雄市膚質檢測從業人員職業工會","高雄市","161915","手工皂實務班","91","20","20260","20250325","20250701"
"高雄縣工商服務職業工會","高雄市","161918","日語會話實務班","45","16","7380","20250301","20250621"
"高雄縣工商服務職業工會","高雄市","161919","居家飾品彩繪實務班","54","22","10080","20250306","20250508"
"高雄縣職業總工會","高雄市","161923","實用日語會話班","45","16","8460","20250225","20250603"
"高雄縣職業總工會","高雄市","161924","紫微斗數命理實務班","39","22","6900","20250306","20250605"
"高雄縣職業總工會","高雄市","161925","手機攝影短片實務班","45","18","8140","20250312","20250604"
"大高雄傳統整復員職業工會","高雄市","161927","傳統整復推拿刮痧拔罐與實務職能訓練班","72","18","12400","20250301","20250330"
"大高雄傳統整復員職業工會","高雄市","161928","傳統整復推拿刮痧拔罐與實務職能訓練班","72","16","12400","20250305","20250507"
"同德學校財團法人南投縣同德高級中等學校附設職業訓練中心","南投縣","161937","創意伴手禮實務班","56","24","11500","20250308","20250510"
"社團法人台灣多元人力資源發展協會","彰化縣","161938","西式饗宴料理班","48","30","9500","20250314","20250711"
"社團法人彰化縣文創休閒餐旅協會","彰化縣","161939","中餐烹調葷食基礎班","72","25","14850","20250305","20250528"
"社團法人彰化縣文創休閒餐旅協會","彰化縣","161940","下午茶蛋糕甜點班","63","25","12850","20250308","20250510"
"社團法人彰化縣文創休閒餐旅協會","彰化縣","161941","日式星野酵母麵包班","63","25","12950","20250309","20250511"
"社團法人彰化縣文創休閒餐旅協會","彰化縣","161942","熱門米麵食小吃班","77","25","15850","20250315","20250607"
"社團法人臺中市多益國際英語測驗協會","臺中市","161944","多益實力培訓暨應試技巧班","30","28","5670","20250313","20250522"
"中華民國經絡鬆筋整體健康協會","高雄市","161947","經絡調理手技與牛角輔具應用課程班","97","22","16780","20250316","20250622"
"中華民國經絡鬆筋整體健康協會","高雄市","161948","傳統整復推拿初級技術員課程(刮痧與拔罐)班","138","20","23840","20250322","20250719"
"社團法人中國傳統整復療法協會","高雄市","161954","傳統整復推拿技術員單元課程(含法規教育)班","144","18","24500","20250316","20250713"
"社團法人台灣水上安全運動推廣協會","高雄市","161963","浮潛從業人員訓練班","46","18","9120","20250304","20250319"
"樹德科技大學","臺中市","161966","實務神秘客培訓班","24","17","4690","20250221","20250223"
"社團法人高雄市勞資事務協進會附設職業訓練中心","高雄市","161971","營造業甲種職業安全衛生業務主管訓練班","42","23","5400","20250311","20250328"
"屏東縣工業會","屏東縣","161974","手沖與義式咖啡拉花實作班","42","22","9950","20250309","20250427"
"屏東縣工業會","屏東縣","161975","創意皮革打版手縫班","54","24","12020","20250322","20250628"
"財團法人中國生產力中心附設高雄服務處","高雄市","161977","ChatGPT AI智能整合應用班","30","30","5520","20250305","20250409"
"義守大學","高雄市","161979","觀光日文實務訓練班","46","25","8510","20250301","20250613"
"義守大學","高雄市","161980","記帳士專業初階訓練班","78","25","12870","20250322","20250628"
"高雄市星相卜卦與堪輿業職業工會","高雄市","161981","易經卜卦實務班","48","25","5000","20250311","20250515"
"高雄市星相卜卦與堪輿業職業工會","高雄市","161982","室內風水設計實務班","54","25","5300","20250315","20250517"
"高雄市星相卜卦與堪輿業職業工會","高雄市","161983","塔羅占卜實用技能班","48","25","5200","20250325","20250708"
"高雄市語文教學從業人員職業工會","高雄市","161986","韓語實用會話入門班","30","24","5670","20250314","20250523"
"高雄市語文教學從業人員職業工會","高雄市","161987","多益英語能力班","36","22","6660","20250318","20250502"
"高雄市語文教學從業人員職業工會","高雄市","161988","韓語會話應用入門班","30","22","5670","20250325","20250527"
"高雄市總工會","高雄市","161996","生活家飾彩繪實務班","48","25","7700","20250225","20250513"
"高雄市總工會","高雄市","161997","創意時尚服裝打版縫紉班","54","20","10500","20250306","20250520"
"高雄市總工會","高雄市","161998","清潔用品及保養品調製班","54","25","8550","20250315","20250517"
"臺東縣經絡調理服務人員職業工會","臺東縣","162002","傳統整復推拿調理員課程班","54","18","9350","20250308","20250330"
"社團法人中華育群人才技藝發展協會","臺中市","162009","室內園藝景觀植物栽培應用班","42","19","9200","20250309","20250427"
"屏東縣各業勞動力就業推廣協會","屏東縣","162010","快剪實務班","64","20","14750","20250309","20250622"
"屏東縣推拿與民俗傳統療法服務業職業工會","屏東縣","162013","傳統整復推拿技術員課程A班","126","24","21800","20250301","20250426"
"社團法人彰化縣身心障礙者無障礙發展協會","彰化縣","162014","傳統圖紋與時尚皮革應用設計班","48","22","10280","20250304","20250617"
"屏東縣推拿與民俗傳統療法服務業職業工會","屏東縣","162015","肌肉評估/調理與經絡調理實務班","144","24","24900","20250314","20250712"
"全國工人總工會","彰化縣","162020","烘焙麵包實務技能訓練班","54","30","10500","20250310","20250707"
"全國工人總工會","彰化縣","162021","亞洲特色料理班","54","30","10500","20250312","20250709"
"彰化縣米食製品從業人員職業工會","彰化縣","162022","異國料理實作班","54","30","10500","20250310","20250707"
"彰化縣米食製品從業人員職業工會","彰化縣","162023","食物製備技能班","54","30","10500","20250318","20250715"
"臺灣管理顧問業產業工會","臺中市","162024","勞動基準法解析及案例研討班","30","20","5620","20250301","20250329"
"社團法人屏東縣生涯發展協會","屏東縣","162029","職涯發展與生涯規劃設計班","24","16","4740","20250322","20250419"
"高雄市外燴飲食職業工會","高雄市","162032","總舖師料理班","100","25","20600","20250301","20250419"
"高雄市製粉加工職業工會","高雄市","162035","烘焙麵食造型班","100","25","20600","20250308","20250426"
"社團法人中華芳香調理教育學會","高雄市","162037","芳香調理專業員培訓班","72","20","16630","20250301","20250510"
"社團法人中華民國人身安全管理公益協會","高雄市","162038","初級救護技術員訓練班","48","25","6580","20250301","20250316"
"中華民國指甲彩繪美容職業工會聯合會","桃園市","162040","凝膠美甲彩繪創作設計班","84","25","16750","20250308","20250607"
"中華民國指甲彩繪美容職業工會聯合會","桃園市","162041","沙龍手部護理與凝膠造型彩繪班","77","25","15250","20250316","20250615"
"中原大學","桃園市","162043","財務金融實務應用班","24","30","4500","20250308","20250329"
"中原大學","桃園市","162044","實用韓語應用實務班","36","20","6800","20250310","20250526"
"社團法人台灣健康美學發展協會","新竹縣","162047","幾何折疊托特包開版實作班","56","22","12470","20250301","20250426"
"苗栗縣總工會","苗栗縣","162049","時尚咖啡飲品調製班","47","18","10000","20250308","20250503"
"苗栗縣總工會","苗栗縣","162050","芳香照護實務應用班","47","18","11400","20250306","20250703"
"苗栗縣總工會","苗栗縣","162053","乾燥花與永生花設計美學手作班","47","18","10800","20250307","20250704"
"社團法人中華人才交流協會","臺中市","162054","不動產經紀相關法規實務班","33","18","5400","20250313","20250605"
"苗栗縣總工會","苗栗縣","162056","蝶谷巴特複合式媒材拼貼藝術實作班","47","18","10800","20250305","20250618"
"社團法人中華國際技能交流協會","臺中市","162057","企業淨零碳規劃管理實務訓練班","42","22","7720","20250220","20250327"
"社團法人桃園市天韻音樂協會","桃園市","162059","流行音樂古箏彈奏實務班","72","20","11990","20250308","20250607"
"社團法人桃園市天韻音樂協會","桃園市","162060","流行音樂二胡拉弦演奏班","72","20","11520","20250309","20250608"
"苗栗縣骨節整復職業工會","苗栗縣","162061","傳統整復推拿(含腳底按摩)技術訓練班","128","25","15600","20250301","20250427"
"嘉義市工商服務職業工會","嘉義市","162063","創意生活木質家具訓練班","60","29","13360","20250304","20250506"
"嘉義市工商服務職業工會","嘉義市","162064","綠美化園藝植栽訓練班","54","26","11580","20250323","20250525"
"嘉義市總工會","嘉義市","162067","時尚布藝創意袋包設計班","60","30","13360","20250225","20250429"
"嘉義市總工會","嘉義市","162068","創意點心手作烘焙訓練班","60","28","12370","20250308","20250517"
"嘉義市總工會","嘉義市","162069","流行服裝打版訓練班","54","26","12020","20250312","20250507"
"嘉義市總工會","嘉義市","162070","園藝植栽訓練班","54","29","11580","20250312","20250507"
"社團法人台灣資產評估協會","高雄市","162071","買賣房屋評估與修繕工程實務班","39","18","7000","20250325","20250617"
"財團法人鞋類暨運動休閒科技研發中心","高雄市","162075","經典鞋品實作班","54","20","12020","20250308","20250510"
"財團法人鞋類暨運動休閒科技研發中心","高雄市","162076","袋包設計開發與基礎針車操作班","54","20","12020","20250316","20250525"
"中華藝能文創產業工會","高雄市","162078","手機拍攝技巧實務班","36","18","6300","20250322","20250503"
"嘉義市成衣服飾整理加工業職業工會","嘉義市","162080","服裝染繪訓練班","60","31","13360","20250316","20250525"
"中華民國公寓大廈管理服務職業總工會","高雄市","162087","綠能公寓大廈事務人員班","48","30","8310","20250322","20250413"
"社團法人臺中市嬰幼兒福利聯合會","臺中市","162089","嬰幼兒按摩訓練班","18","30","3330","20250308","20250322"
"社團法人台灣手工藝文創協會","臺中市","162091","香氛蠟藝實務班","47","25","12030","20250308","20250426"
"高雄市飾品加工職業工會","高雄市","162094","手工皂與直播電商實作班","60","25","9950","20250308","20250517"
"國立中興大學","臺中市","162097","TTQS企業機構版指標課程班","24","25","4320","20250312","20250409"
"國立中興大學","臺中市","162098","職場人際溝通實務班","36","24","6660","20250325","20250617"
"彰化縣職能技藝發展協會","彰化縣","162105","米麵食料理製作班","54","30","10500","20250311","20250708"
"台中市室內裝潢業職業工會","臺中市","162106","建築物室內裝修工程管理實務班","66","30","8000","20250308","20250524"
"台中市室內裝潢業職業工會","臺中市","162107","室內裝修工程識圖與估價初階班","48","25","7440","20250315","20250510"
"社團法人中華菁鷹人才技能學習協會","臺中市","162109","金融資產投資理財規劃實務班","42","18","7890","20250317","20250505"
"屏東縣傳統整復員職業工會","屏東縣","162110","傳統整復推拿技術員手法課程班","94","18","16280","20250302","20250504"
"新竹市中餐服務人員職業工會","新竹市","162113","中餐烹調實務訓練班","60","25","12370","20250321","20250606"
"社團法人中華民國數位科技推廣協會","臺中市","162114","AI生成與創意設計：Illustrator實戰應用班","42","22","7920","20250315","20250503"
"社團法人台灣職能培育協會","彰化縣","162117","中式點心烘焙班","54","30","10500","20250304","20250701"
"社團法人台灣職能培育協會","彰化縣","162118","西點蛋糕技能班","48","30","9500","20250306","20250703"
"社團法人台灣職能培育協會","彰化縣","162119","中餐料理實務班","48","30","9500","20250313","20250710"
"高雄市就業服務商業同業公會","高雄市","162120","就業服務與勞動法令輔導班","33","23","6230","20250308","20250419"
"社團法人台灣多元性設計創作協會","臺中市","162135","AutoCAD精密機械設計製圖班","54","23","8910","20250309","20250511"
"社團法人台灣多元性設計創作協會","臺中市","162136","Youtube影音特效剪輯實務班","54","20","8910","20250309","20250511"
"社團法人台灣創造活動發展協會","臺中市","162139","AI應用文書軟體實務應用班","54","20","8910","20250308","20250517"
"社團法人台灣創造活動發展協會","臺中市","162140","AutoCAD精密機械設計製圖班","54","26","8910","20250309","20250511"
"彰化縣工業會","彰化縣","162143","碳盤查(ISO14064-1、ISO14067)內部稽核人員訓練專班","36","21","6010","20250315","20250426"
"臺中市不動產經紀人公會","臺中市","162148","不動產營業員複訓班","20","35","3500","20250325","20250327"
"臺中市飾品創作市集交流發展協會","臺中市","162150","皮革創作應用手縫班","90","24","16600","20250302","20250629"
"社團法人台灣職業訓練多元發展協會","臺中市","162151","兩穿抽皺衫與哈倫褲實作班","72","18","15950","20250301","20250524"
"臺灣總工會附設職業訓練中心","臺中市","162154","皮革與帆布混搭打版製作班","72","25","12910","20250308","20250607"
"社團法人台灣職場技能協進會","臺中市","162157","越南語初級班","36","20","6780","20250222","20250412"
"社團法人台灣藝術人文與教育科技協會","臺中市","162161","ESG永續經營與碳盤查管理班","42","13","7900","20250323","20250504"
"社團法人台灣藝術人文與教育科技協會","臺中市","162162","Python程式設計基礎與AI 機器學習應用班","48","12","9030","20250323","20250518"
"社團法人臺中市生活藝能美學協進會","臺中市","162164","禪繞畫美學繪圖班","40","15","8340","20250304","20250513"
"社團法人臺中市生活藝能美學協進會","臺中市","162165","鑲嵌玻璃工藝設計班","52","30","11500","20250305","20250611"
"社團法人臺中市生活藝能美學協進會","臺中市","162166","中日茶藝展演班","48","20","8700","20250322","20250524"
"臺灣總工會","臺中市","162167","皮革工藝基礎打版製作班","54","25","8610","20250311","20250506"
"財團法人中國生產力中心附設中區服務處","臺中市","162173","AutoCAD繪圖實務班","54","20","10150","20250310","20250421"
"財團法人中國生產力中心附設中區服務處","臺中市","162174","SolidWorks零件設計與曲線應用班","54","20","10700","20250318","20250522"
"中華民國人體彩繪從業人員職業工會全國聯合會","臺中市","162181","花魁藝術彩繪整體造型自媒體行銷進階班","72","25","15400","20250313","20250605"
"中華產業人才認證學會","桃園市","162182","新制多益英文聽力閱讀訓練班","45","20","8500","20250317","20250623"
"台中市飾品加工職業工會","臺中市","162183","皮雕工藝手縫班","90","24","16600","20250306","20250626"
"台中市飾品加工職業工會","臺中市","162184","皮革雕刻工藝手縫班","90","24","16600","20250308","20250628"
"中華產業人才認證學會","桃園市","162185","初級Excel及自動化處理應用班","45","20","8500","20250310","20250505"
"彰化縣美容美髮用品器材製造裝修職業工會","彰化縣","162186","美髮造型與用品器材操作進階班","78","30","16300","20250316","20250629"
"財團法人鞋類暨運動休閒科技研發中心","臺中市","162189","皮件設計人員班","144","18","31990","20250308","20250608"
"財團法人鞋類暨運動休閒科技研發中心","臺中市","162190","皮件手工藝設計助理班","54","20","12020","20250309","20250518"
"財團法人鞋類暨運動休閒科技研發中心","臺中市","162191","時尚女包與基礎針車操作班","36","18","8100","20250316","20250427"
"社團法人台灣省安全衛生教育協會附設高雄職業訓練中心","高雄市","162196","急救人員訓練班","16","20","3020","20250312","20250319"
"國立高雄大學","臺中市","162202","OFFICE辦公室整合應用班","48","25","7400","20250311","20250508"
"社團法人台灣整體美國際交流協會","高雄市","162203","美甲技能實務班","98","20","22630","20250312","20250611"
"高雄中餐服務人員職業工會附設職業訓練中心","高雄市","162204","中餐烹調技能班","87","30","17940","20250310","20250516"
"高雄市理燙髮美容業職業工會附設職業訓練中心","高雄市","162206","美容進階班","98","20","22630","20250313","20250619"
"高雄市理燙髮美容業職業工會附設職業訓練中心","高雄市","162207","美容技能實務班","98","20","22630","20250314","20250627"
"全國美容美髮業產業工會","高雄市","162208","時尚剪染吹造型實務班","98","20","22630","20250309","20250622"
"高雄市理燙髮美容業職業工會","高雄市","162212","男子理髮技能實務班","98","20","22630","20250311","20250610"
"高雄市理燙髮美容業職業工會","高雄市","162213","美髮進階班","98","20","22630","20250311","20250610"
"高雄市理燙髮美容業職業工會","高雄市","162214","男士快剪燙髮造型及頭皮按摩實務班","98","20","22630","20250313","20250619"
"中華民國經絡鬆筋整體健康協會","臺北市","162216","經絡調理手技與牛角輔具應用課程班","97","22","16770","20250306","20250619"
"中華民國經絡鬆筋整體健康協會","臺北市","162217","傳統整復推拿初級技術員課程(刮痧與拔罐)班","138","20","20700","20250308","20250517"
"中華民國經絡鬆筋整體健康協會","臺北市","162218","經絡調理手技與牛角輔具應用班","77","22","13310","20250308","20250517"
"中華民國經絡鬆筋整體健康協會","臺北市","162219","被動式肌肉按摩與關節放鬆實作班","70","20","12090","20250318","20250520"
"宜蘭縣仲介業從業人員職業工會","宜蘭縣","162231","不動產營業員複訓班","21","20","3900","20250311","20250313"
"宜蘭縣租賃住宅服務商業同業公會","宜蘭縣","162236","租賃住宅管理人員訓練班","31","21","5800","20250317","20250320"
"宜蘭縣推銷員職業工會","宜蘭縣","162238","客製化觀光產業傢飾品製作實務班","84","16","16100","20250315","20250614"
"社團法人中華不動產職能訓練發展協會","宜蘭縣","162242","不動產經紀人實務訓練班","30","20","5650","20250308","20250316"
"社團法人台灣國際工商人才發展交流協會","臺北市","162247","多益商務英文聽力實用班","24","20","4500","20250317","20250519"
"社團法人宜蘭縣職涯發展協會","宜蘭縣","162248","木工工藝設計班","102","25","18400","20250304","20250506"
"社團法人臺北市第二專長協會","臺北市","162250","職場英文實務會話班","30","22","5650","20250307","20250516"
"社團法人臺北市第二專長協會","臺北市","162251","AI實務應用班","42","25","7900","20250303","20250416"
"社團法人臺灣服務稽核協會","臺北市","162255","實務神秘客培訓班","24","17","4760","20250307","20250309"
"基隆市全民勞工總工會","基隆市","162259","全球金融市場分析及資產配置班","36","25","7850","20250301","20250412"
"基隆市建築材料業職業工會","基隆市","162265","家用電器保養與檢修實作班","42","25","10750","20250302","20250420"
"基隆市建築材料業職業工會","基隆市","162266","居家住宅風水格局設計班","42","25","9750","20250301","20250419"
"新北市冰果冷飲服務業職業工會","新北市","162271","糖霜餅乾文創實務班","42","36","8220","20250223","20250413"
"臺北市公務機關總工會","臺北市","162277","實用英語聽說讀寫班","54","23","8690","20250301","20250503"
"臺北市芳薰香植物精油服務人員職業工會","臺北市","162279","芳香精油調製應用實務班","56","30","12500","20250301","20250426"
"臺北市保險業務職業工會","臺北市","162280","保險經紀人訓練班","47","25","9350","20250308","20250503"
"臺北市保險業務職業工會","臺北市","162283","保險從業人員民法實務及案例解析班","30","30","5690","20250313","20250605"
"臺北市解說員職業工會","臺北市","162285","觀光美食解說班","63","40","12810","20250221","20250509"
"臺北市翻譯業職業工會","臺北市","162286","電子書出版實務班","47","20","8800","20250315","20250621"
"社團法人宜蘭縣美學才藝發展協會","宜蘭縣","162288","陶瓷彩繪應用設計班","54","18","10800","20250224","20250423"
"社團法人宜蘭縣美學才藝發展協會","宜蘭縣","162289","創意整體造型設計班","96","18","19700","20250306","20250626"
"中國科技大學","臺北市","162292","綠生活香氛設計班","30","20","7470","20250308","20250412"
"中華民國不動產代銷經紀商業同業公會全國聯合會","臺北市","162293","房屋買賣法律與稅務實務訓練班","36","17","6800","20250308","20250419"
"中華產業人才認證學會","新北市","162308","日文Ｎ４進階班","45","20","8500","20250306","20250626"
"台北市職業總工會","臺北市","162309","商務英文會話班","45","18","8520","20250304","20250424"
"中華產業人才認證學會","新北市","162310","日文Ｎ３中級班","45","20","8500","20250318","20250624"
"中華產業人才認證學會","新北市","162312","日文Ｎ１高級班","45","20","8500","20250319","20250625"
"中華產業人才認證學會","臺北市","162313","韓語發音及實用會話基礎班","45","20","8500","20250319","20250709"
"中華產業人才認證學會","臺北市","162315","韓語實用會話初級班","45","20","8500","20250318","20250624"
"台北市電器商業同業公會","臺北市","162321","Excel X ChatGPT數據分析應用班","42","38","6720","20250322","20250510"
"台北市網路技術研發人員職業工會","臺北市","162324","Photoshop技巧處理與設計實務班","36","28","6830","20250312","20250528"
"台北市保險業職業工會","臺北市","162325","道路交通事故處理實務班","30","25","4950","20250304","20250401"
"台北市總工會","臺北市","162326","傳統小吃與異國風情料理班","64","36","12800","20250308","20250330"
"台北市保險業職業工會","臺北市","162327","民法總則暨物權實務研析班","42","25","7140","20250305","20250416"
"台北市流行音樂產業工會","臺北市","162328","流行音樂歌唱人員創意訓練班","46","24","8690","20250225","20250603"
"宜蘭縣木材商業同業公會","宜蘭縣","162331","建築創意家俱美學佈置實作班","102","25","20000","20250312","20250530"
"社團法人中華育群人才技藝發展協會","臺北市","162335","法語初級會話班","47","18","8910","20250306","20250626"
"社團法人中華育群人才技藝發展協會","臺北市","162336","韓語會話入門班","47","18","8910","20250303","20250623"
"財團法人水源地文教基金會","臺北市","162337","藍染美學蠟染實作班","42","24","10740","20250309","20250427"
"社團法人中華民國人才育成協會","臺北市","162338","CANVA商業設計AI實務班","30","25","6230","20250321","20250606"
"社團法人中華民國人才育成協會","臺北市","162339","銷售與溝通管理技巧班","30","24","5950","20250303","20250505"
"財團法人水源地文教基金會","臺北市","162340","化妝保養品配方設計調製實作班","42","24","10740","20250308","20250426"
"社團法人中華民國勞動力發展協會","臺北市","162346","常見企業簽約實務班","30","25","4890","20250315","20250419"
"社團法人中華活力職能發展協會","臺北市","162350","套房設計裝修與租賃管理人才培訓班","35","25","6510","20250313","20250417"
"台北市工業會","臺北市","162351","ChatGPT行銷應用實作班","30","23","5050","20250302","20250330"
"社團法人中華美妍技術國際交流協會","臺北市","162357","芳香紓壓調理保健技能實務班","60","24","13760","20250315","20250524"
"社團法人宜蘭縣餐飲推廣協會","宜蘭縣","162359","複合式餐飲烘焙訓練班","96","30","18700","20250223","20250622"
"社團法人中華美容技藝促進協會附設職業訓練中心","新北市","162360","美容皮膚與諮詢服務訓練班","36","20","7000","20250308","20250419"
"社團法人宜蘭縣餐飲推廣協會","宜蘭縣","162361","中餐烹調訓練班","60","20","12350","20250226","20250418"
"花蓮縣新風貌促進會","花蓮縣","162364","食尚甜點烘焙實務班","54","20","10900","20250225","20250429"
